{
  "tarea_id": "2026-10-viaje-barco-ida-vuelta",
  "aprobado": true,
  "estado_destino": "verificada",
  "hallazgos": [
    {
      "invariante": "notebook",
      "severidad": "advertencia",
      "ubicacion": "guia.materiales.notebook",
      "descripcion": "notebook escenarios.ipynb no encontrado: ",
      "origen": "codigo"
    },
    {
      "invariante": "semantica",
      "severidad": "advertencia",
      "ubicacion": "guia.escenarios E1.que_aprende y guia.puesta_en_comun.seleccion_y_orden (cuarto punto)",
      "descripcion": "En N3_AA_r1 el grupo primero dice que Rosebank cabe en el día a 30 km/h y luego corrige el umbral a unos 26 km/h. — La traza de N3_AA_r1 solo registra la respuesta final con el umbral de unos 26 km/h. No hay registro de una afirmación previa a 30 km/h, y el extracto de diálogo del propio escenario tampoco la muestra. El umbral final sí está respaldado (257,4 ÷ 10 = 25,74).",
      "origen": "modelo"
    },
    {
      "invariante": "semantica",
      "severidad": "advertencia",
      "ubicacion": "guia.escenarios E1.ruta y que_aprende",
      "descripcion": "Ruta única P1-MRS, P2-RM, P4-WM, P5-INT, P4-WM, P6-VAL, P7-EXP, y la frase 'estos grupos' obtienen 48,28 km/h para Jackdaw y lo descartan. — Esa ruta corresponde solo a N3_AA_r1. N4_VV_r1 sigue otra ruta: P1-MRS, P2-RM, P4-WM, P2-RM, P4-WM, P6-VAL, P7-EXP, sin P5-INT. Además, el cálculo de la rapidez necesaria para Jackdaw y su descarte por poco realista aparecen solo en N3_AA_r1, no en N4_VV_r1.",
      "origen": "modelo"
    },
    {
      "invariante": "semantica",
      "severidad": "advertencia",
      "ubicacion": "tarea.estudiante.recursos_a_solicitud R3",
      "descripcion": "Los puertos suelen cerrar de noche para descargar. — Es una afirmación sobre el mundo que no figura en las fuentes. La propia guía reconoce que no tiene fuente y la trata como supuesto discutible.",
      "origen": "modelo"
    }
  ],
  "cifras_contrastadas": [
    {
      "indice": 0,
      "que_es": "distancia de Jackdaw al este de Aberdeen (equivalente en km)",
      "valor_tarea": "241.4km",
      "localizador": {
        "fuente": "noticia",
        "ubicacion": "párrafo 57"
      },
      "metodo": "codigo+modelo",
      "valor_fuente": "241.4km",
      "resultado": "coincide",
      "nota": "valor igual al de la noticia; modelo: Coincide en valor, unidad y significado: es el equivalente en km de la distancia de Jackdaw al este de Aberdeen (párrafo 57)."
    },
    {
      "indice": 1,
      "que_es": "distancia de Rosebank al noroeste de Shetland (equivalente en km)",
      "valor_tarea": "128.7km",
      "localizador": {
        "fuente": "noticia",
        "ubicacion": "párrafo 58"
      },
      "metodo": "codigo+modelo",
      "valor_fuente": "128.7km",
      "resultado": "coincide",
      "nota": "valor igual al de la noticia; modelo: Coincide en valor, unidad y significado: es el equivalente en km de la distancia de Rosebank al noroeste de Shetland (párrafo 58)."
    }
  ],
  "notebook": {
    "estado": "no_encontrado",
    "ruta": "escenarios.ipynb",
    "salida_resumen": ""
  },
  "meta": {
    "agente": "verificador",
    "version_prompt": "1.0",
    "modelo": "claude-opus-5-5",
    "request_id": "req_011CgEDPjex8atVc8t1go4Y6",
    "fecha": "2026-10-20T21:40:34+00:00",
    "costo_usd": 0.117705,
    "modelo_llamado": true,
    "texto_noticia_recibido": true,
    "uso": {
      "input_tokens": 15216,
      "output_tokens": 2827,
      "cache_creation_input_tokens": 0,
      "cache_read_input_tokens": 1503
    }
  }
}
