{
  "tarea_id": "2026-10-embalse-el-yeso",
  "aprobado": false,
  "estado_destino": "simulada",
  "hallazgos": [
    {
      "invariante": "notebook",
      "severidad": "advertencia",
      "ubicacion": "guia.materiales.notebook",
      "descripcion": "notebook escenarios.ipynb no encontrado: ",
      "origen": "codigo"
    },
    {
      "invariante": "coherencia",
      "severidad": "advertencia",
      "ubicacion": "guia.escenarios.E1.modelo",
      "descripcion": "modelo 'proporcional' distinto de los de las corridas citadas",
      "origen": "codigo"
    },
    {
      "invariante": "coherencia",
      "severidad": "advertencia",
      "ubicacion": "guia.escenarios.E1.ruta",
      "descripcion": "la ruta no es idéntica a la de ninguna corrida citada",
      "origen": "codigo"
    },
    {
      "invariante": "coherencia",
      "severidad": "advertencia",
      "ubicacion": "guia.escenarios.E2.modelo",
      "descripcion": "modelo 'proporcional' distinto de los de las corridas citadas",
      "origen": "codigo"
    },
    {
      "invariante": "semantica",
      "severidad": "critico",
      "ubicacion": "tarea.estudiante.enunciado_es",
      "descripcion": "Las autoridades dicen que no hay riesgo este verano. — El resumen de la noticia no menciona ninguna declaración de las autoridades sobre el riesgo. Es un dato factual atribuido a la noticia sin respaldo en las fuentes.",
      "origen": "modelo"
    },
    {
      "invariante": "semantica",
      "severidad": "advertencia",
      "ubicacion": "tarea.estudiante.recursos_a_solicitud[R2]",
      "descripcion": "Consumo mensual estimado atribuido a un informe de la empresa sanitaria — Según el resumen, la propia noticia entrega el consumo mensual estimado, pero no aparece entre sus cifras. Atribuirlo a otra fuente no consta en las fuentes, y el recurso no trae ningún valor que se pueda verificar.",
      "origen": "modelo"
    },
    {
      "invariante": "semantica",
      "severidad": "critico",
      "ubicacion": "tarea.task_space.reference_solution.result y acceptable_range; guia.analisis_a_priori.rango_aceptable",
      "descripcion": "entre 5 y 7 meses; rango aceptable de 4 a 8 meses — El volumen útil (0,38 × 220 = 83,6 millones de m3) sí sale de las fuentes. En cambio, no hay ningún valor de consumo en fuentes ni en trazas, así que el resultado en meses no se puede derivar ni comprobar.",
      "origen": "modelo"
    },
    {
      "invariante": "semantica",
      "severidad": "critico",
      "ubicacion": "tarea.task_space.routes[R2].resultado y routes[R3].resultado",
      "descripcion": "R2 lineal con aportes ≈ 7 meses; R3 dinámico ≈ 5 meses — No hay dato de consumo, aportes ni evaporación en las fuentes. Además, las trazas contradicen estos resultados: las corridas con modelo lineal (N3_AA_r1, N4_VV_r1) y dinámico (N4_AA_r1) responden unos 6 meses.",
      "origen": "modelo"
    },
    {
      "invariante": "semantica",
      "severidad": "advertencia",
      "ubicacion": "tarea.task_space.routes[R1].resultado",
      "descripcion": "proporcional ≈ 6 meses — Coincide con las respuestas de las corridas proporcionales, pero no se puede calcular desde las fuentes porque falta el valor de consumo.",
      "origen": "modelo"
    },
    {
      "invariante": "semantica",
      "severidad": "critico",
      "ubicacion": "guia.escenarios[E1].modelo",
      "descripcion": "modelo proporcional — Las dos corridas citadas (N4_VV_r1 y N3_AA_r1) usaron el modelo lineal, no el proporcional.",
      "origen": "modelo"
    },
    {
      "invariante": "semantica",
      "severidad": "advertencia",
      "ubicacion": "guia.escenarios[E1].ruta",
      "descripcion": "Ruta sin P6-VAL — Ambas corridas citadas incluyen P6-VAL y validan (validacion true). El escenario omite la fase de validación.",
      "origen": "modelo"
    },
    {
      "invariante": "semantica",
      "severidad": "critico",
      "ubicacion": "guia.escenarios[E2].modelo y extracto_dialogo",
      "descripcion": "Modelo proporcional; diálogo que concluye usar solo lo que queda — La corrida citada N1_AA_r1 usó el modelo de capacidad total, que es justamente el modelo inadecuado. El escenario describe un modelo y un razonamiento que esa corrida no tuvo.",
      "origen": "modelo"
    },
    {
      "invariante": "semantica",
      "severidad": "advertencia",
      "ubicacion": "guia.escenarios[E2].bloqueos",
      "descripcion": "Solo bloqueo B23 — N1_AA_r1 registra bloqueos en B12 y en B23. Se omite B12.",
      "origen": "modelo"
    },
    {
      "invariante": "semantica",
      "severidad": "advertencia",
      "ubicacion": "guia.escenarios[E1,E2,E3].bloqueos.como_se_destrabo",
      "descripcion": "un compañero propuso dibujar el embalse — Las trazas solo registran que la resolución fue entre pares (peer). El detalle de dibujar el embalse no consta.",
      "origen": "modelo"
    }
  ],
  "cifras_contrastadas": [
    {
      "indice": 0,
      "que_es": "capacidad del embalse (ejemplo ficticio)",
      "valor_tarea": 220,
      "localizador": {
        "fuente": "noticia",
        "ubicacion": "párrafo 2"
      },
      "metodo": "codigo+modelo",
      "valor_fuente": 220,
      "resultado": "coincide",
      "nota": "valor igual al de la noticia; modelo: Mismo valor, unidad y significado: capacidad total, no volumen actual."
    },
    {
      "indice": 1,
      "que_es": "nivel actual del embalse (ejemplo ficticio)",
      "valor_tarea": "38 %",
      "localizador": {
        "fuente": "noticia",
        "ubicacion": "gráfico 1"
      },
      "metodo": "codigo+modelo",
      "valor_fuente": "38 %",
      "resultado": "coincide",
      "nota": "valor igual al de la noticia; modelo: Mismo valor y significado: nivel actual expresado como porcentaje de la capacidad."
    }
  ],
  "notebook": {
    "estado": "no_encontrado",
    "ruta": "escenarios.ipynb",
    "salida_resumen": ""
  },
  "meta": {
    "agente": "verificador",
    "version_prompt": "1.0",
    "modelo": "claude-opus-5-5",
    "request_id": "req_011CgE1PwqnZWzXbuEpmLLqz",
    "fecha": "2026-10-20T19:03:11+00:00",
    "costo_usd": 0.072719,
    "modelo_llamado": true,
    "texto_noticia_recibido": false,
    "uso": {
      "input_tokens": 4161,
      "output_tokens": 2428,
      "cache_creation_input_tokens": 1503,
      "cache_read_input_tokens": 0
    }
  }
}