{
  "tarea_id": "2026-10-pagar-trasladar-o-esperar-v2",
  "aprobado": false,
  "estado_destino": "simulada",
  "hallazgos": [
    {
      "invariante": "notebook",
      "severidad": "advertencia",
      "ubicacion": "guia.materiales.notebook",
      "descripcion": "notebook escenarios.ipynb no encontrado: ",
      "origen": "codigo"
    },
    {
      "invariante": "semantica",
      "severidad": "critico",
      "ubicacion": "tarea.estudiante.recursos_a_solicitud[R3]",
      "descripcion": "fuente genérica o sin localizador ('noticia, resumen del caso'): toda afirmación factual de un recurso debe venir de la noticia con «párrafo N», de «otra fuente: <organismo/publicación>» o estar marcada como «supuesto del escenario»",
      "origen": "codigo"
    }
  ],
  "cifras_contrastadas": [
    {
      "indice": 0,
      "que_es": "Valor aproximado de los bienes canadienses gravados",
      "valor_tarea": "$20bn",
      "localizador": {
        "fuente": "noticia",
        "ubicacion": "párrafo 49"
      },
      "metodo": "codigo",
      "valor_fuente": "$20bn",
      "resultado": "coincide",
      "nota": "valor igual al de la noticia"
    },
    {
      "indice": 1,
      "que_es": "Arancel que paga una empresa estadounidense sobre queso exportado desde Canadá",
      "valor_tarea": "50%",
      "localizador": {
        "fuente": "noticia",
        "ubicacion": "párrafo 53"
      },
      "metodo": "codigo",
      "valor_fuente": "50%",
      "resultado": "coincide",
      "nota": "valor igual al de la noticia"
    }
  ],
  "notebook": {
    "estado": "no_encontrado",
    "ruta": "escenarios.ipynb",
    "salida_resumen": ""
  },
  "meta": {
    "agente": "verificador",
    "version_prompt": "1.1",
    "modelo": null,
    "request_id": null,
    "fecha": "2026-10-20T22:01:47+00:00",
    "costo_usd": 0.0,
    "modelo_llamado": false,
    "texto_noticia_recibido": true,
    "uso": null
  }
}
